{
  "resourceType": "Bundle",
  "type": "transaction",
  "signature": {
    "type": [{ "system": "urn:handover:signature-type", "code": "signature" }],
    "when": "2026-10-08T10:00:00Z",
    "who": { "identifier": { "value": "nurse-synthetic" } },
    "sigFormat": "image/png",
    "data": "c3ludGhldGljLXBuZw=="
  },
  "entry": [
    {
      "fullUrl": "urn:uuid:patient-synthetic-1",
      "resource": {
        "resourceType": "Patient",
        "id": "synthetic-001",
        "identifier": [
          {
            "system": "urn:handover-pro:patient-id",
            "value": "synthetic-001"
          }
        ]
      },
      "request": {
        "method": "POST",
        "url": "Patient"
      }
    },
    {
      "fullUrl": "urn:uuid:obs-synthetic-1",
      "resource": {
        "resourceType": "Observation",
        "id": "obs-synthetic-1",
        "status": "final",
        "code": {
          "coding": [
            {
              "system": "http://loinc.org",
              "code": "8867-4",
              "display": "Heart rate"
            }
          ]
        },
        "subject": {
          "reference": "urn:uuid:patient-synthetic-1"
        },
        "effectiveDateTime": "2026-01-01T08:00:00Z",
        "valueQuantity": {
          "value": 72,
          "unit": "beats/min"
        }
      },
      "request": {
        "method": "POST",
        "url": "Observation"
      }
    }
  ]
}
